439	南柏 THE RESIDENCE	139.956121	35.844969	2948	4079	145 	73.47	85.8	住友商事	2015/4	都心と、駅と、太陽と暮らす駅前レジデンス。	新しくきれいに変わった町の駅前で、便利さや楽しさをよくばる。都心に直結した交通アクセスでオンもオフもわがままする。南向きの心地良さや開放感あふれる眺望を思いのままに堪能する。自分らしいこだわりを活かした住まいで毎日を謳歌する。暮らしはあたらしい価値へとつながることで、より豊かで、より快適なものへと生まれ変わることができます。都心へ、駅へ、街へ、太陽へ、快適へ。全てに「LINK」する貴方と家族の日々が、こお南柏からはじまります。
440	ウィルローズ市川	139.912251	35.729966	4380	6590	246 	67	79	グローバル・エルシード	2014/5	市川の品格を受け継ぐ住処。	生活利便施設が揃う駅周辺を抜けると、そこは、暮らす人々の誇りと優越を刺激する閑静な住宅街。躍動と静寂をともにかなえる邸宅へ。
441	エクセレントシティ市川一丁目	139.908614	35.732037			213 			新日本建設	2014/3	市川 THE ONE 市川一丁目。そこは、格式を継ぐ無二の地。	オンリーワンの風格をたたえる、真の「市川」を知る住まい。「エクセレントシティ市川一丁目」。風雅な気配をまとい、いま、序幕。クロマツが出迎える、閑雅な街の屋敷町。成熟を迎えた屋敷町。その格式を継ぐ、由緒正しき生活舞台。時を経てなお情緒的な風雅を授けてくれる。残すべきものが残された街で、発展を続ける駅前を見守りながら、やすらぎを忘れずに暮らしていこう
442	オーベル市川	139.906594	35.720477	3490	5570	179 	73.84	91.13	大成有楽不動産	2014/8	「市川」を大きく暮らす。	真新しい空気を深呼吸するような、のびやかで心地よい暮らしのために---。時間に縛られない都心への軽快なフットワーク。江戸川の自然を身近に感じる潤いと開放感。周辺と調和しながら美意識を奏でる外観デザイン。そして、ゆとりある広さに、しなやかな提案を盛り込んだ空間。「オーベル市川」、そのすべてが私の暮らしを大きくする。
443	エクセレントスクエア西船橋	139.95927	35.71718	1588	4598	152 	40	88	新日本建設	2012/5	街角照らす、レジデンス。西船街角テラス。	ぼくたちの明るい未来を照らす小さな幸せは、この道の向こうにあった。駅から続くなだらかな道を歩くと、静かで明るい街角に出る。「エクセレントスクエア西船橋」は、その街角で太陽に照らされ、光り輝くように佇んでいます。古くからの人々の暮らしを支えてきた住宅地で、道を行き交う人々の目にとまる場所。そんな街の風景の主役になる、品と格に薫る住まいが今、あたらしい未来を描き出しました。街を照らし、緑を照らし、暮らしを照らす、明るくてやさしくて頼もしいマンション。西船という交通利便に優れた街で、いつまでも変わらない快適とやすらぎを手に入れるために。「西船・街角TERRACE」。そこにはいつお、陽光に包まれて穏やかに軽やかに生きる、家族の笑顔がありました。
501	武蔵浦和SKY&GARDEN	139.647474	35.842986	3800	5500	213 	63.68	79.01	新日鉄興和不動産,三菱商事,三菱地所レジデンス	2015/1	THE OASIS	「ジ・オアシス」。それは都市と住まいを緑の庭園でつなぐ、新発想の街づくりです。再開発で発展を続ける駅前にありながら、そこには豊かな緑をたたえた広大な庭園が広がります。便利なだけではない、緑の潤いの中で憩い、人と人との交流を愉しむ都市の暮らしを---。多世代がともに暮らし、さまざまな時間を心から愛することのできる、新しい庭園都市の誕生です。この街で、人は大きな幸せに満たされていく。
502	浦和常盤ザ・レジデンス	139.641906	35.864839	3900	6600	209 	70.34	92.34	ジェイアール西日本不動産開発,三菱倉庫,西日本鉄道,長谷工コーポレーション	2014/2	浦和常盤、免震邸宅。	桜並木が見守り続けてきた12,000m2超の広大な正形敷地。この地を、桜とともに受け継ぎ、未来へ贈る集邸プロジェクト。中山道の宿場として、江戸時代以前から栄えていた浦和。明治以降は鉄道にて首都と直結、県庁所在地として発展してきました。中でも、浦和常盤は邸宅地として高く評価され、その洗練された市民文化や街を誇り愛する精神は、今も街の風景に息づき、緑深き邸宅街に上質な落ち着きをもたらしています。その閑静な浦和常盤の邸宅街に、歴史ある街並みを継承し、未来へとその誇りを受け継ぐ295邸の新たな邸宅街区を創出します。「文京の歩み重ねし常盤」伝統ある教育施設に囲まれた文教地区「常盤」。アカデミックな街の真ん中にアドレスを得る。
503	プラウド浦和高砂	139.652705	35.856548	5300	6600	243 	75.44	85.84	野村不動産	2015/5	浦和高砂　県都の中枢、「深奥」の地に住む。	
504	プラウド浦和常盤トレサージュ	139.640447	35.872077			241 			野村不動産	2014/10	常盤を語る一邸がある。	
505	シャリエ南浦和神明	139.660124	35.846752	3130	4240	178 	57	80	東レ建設	2014/3	浦和の邸宅街「神明」に佇む、洗練の48邸。	江戸を起点とする中山道の3番目の宿場町として、古くから栄えた浦和界隈。明治4年、埼玉県が誕生すると行政・文化・教育等の中心となり、さらに発展を遂げていきました。そんな歴史の中で歩みを重ねたこの街も、今日では都心への好アクセスを有する住宅街に。〈シャリエ南浦和神明〉が誕生する「南浦和」駅西口には、駅前に百貨店やスーパーを容姿ながらも落ち着いた街並みが広がっています。緑潤う並木道、ひときわ閑静な住宅街「神明」へ---その恵まれた環境と溶け合う洗練の48邸が、今ここに誕生します。